{
  "name": "Test",
  "description": "A workflow",
  "vertical": "handset",
  "stages": [
    {
      "name": "Stage 1",
      "order": 1,
      "type": "DFL",
      "steps": [
        {
          "name": "Stage 1",
          "order": 1,
          "code": "SELECT * FROM X"
        },
        {
          "name": "Stage 2",
          "order": 2,
          "code": "SELECT * FROM X"
        },
        {
          "name": "Stage 3",
          "order": 3,
          "code": "SELECT * FROM X"
        }
      ]
    },
    {
      "name": "Stage 2",
      "order": 2,
      "type": "DFL",
      "steps": [
        {
          "name": "Stage 1",
          "order": 1,
          "code": "SELECT * FROM X"
        },
        {
          "name": "Stage 2",
          "order": 2,
          "code": "SELECT * FROM X"
        }
      ]
    }
  ]
}